{
  "$schema": "https://json-schema.org/draft/2020-12/schema",
  "$id": "https://rtl-buddy.dev/schemas/view-v1.json",
  "title": "rtl-buddy-view view.json v1",
  "description": "Locked schema for the JSON hierarchy + overlay payload consumed by the rtl-buddy-view interactive web viewer (#18). Producer is rtl-buddy-view's --format json renderer. Phase 5 viewer treats this as a stable contract; consumers can rely on field presence + type per this schema for any 1.x payload.",
  "type": "object",
  "required": ["schema_version", "top", "nodes", "edges", "overlays_present"],
  "additionalProperties": true,
  "properties": {
    "schema_version": {
      "type": "string",
      "description": "Schema version as MAJOR.MINOR. 1.x payloads are backward-compatible — minor bumps may add fields, never rename or retype them."
    },
    "top": {
      "type": "string",
      "description": "Rendered root's module name. Equals dut_top when only --top was passed; equals tb_top when --tb-top was passed. Existing v1.0 consumers that read this field need no change."
    },
    "dut_top": {
      "type": ["string", "null"],
      "description": "(v1.1) Module name supplied via --top. Present as a non-null string whenever --top was passed (even alongside --tb-top); null when only --tb-top was passed. SPA draws a DUT boundary box around every instance whose module equals this value; instance-path enumeration is derived at view time from nodes[] (no separate dut_anchors list)."
    },
    "tb_top": {
      "type": ["string", "null"],
      "description": "(v1.1) Module name supplied via --tb-top. Present as a non-null string whenever --tb-top was passed; null when only --top was passed. When non-null the rendered root is the testbench top and the wave path is the identity of the view path (no tb_prefix strip)."
    },
    "tool": {
      "type": "object",
      "description": "Producer self-identification — purely informational; consumers don't gate on it.",
      "required": ["name", "version"],
      "additionalProperties": true,
      "properties": {
        "name": {"type": "string"},
        "version": {"type": "string"}
      }
    },
    "nodes": {
      "type": "array",
      "items": {"$ref": "#/$defs/node"},
      "description": "Every elaborated instance in the hierarchy, sorted by id."
    },
    "edges": {
      "type": "array",
      "items": {"$ref": "#/$defs/edge"},
      "description": "Parent→child instantiation edges, sorted by (from, to)."
    },
    "overlays_present": {
      "type": "array",
      "items": {"type": "string"},
      "description": "Sorted list of overlay names whose annotation payloads contributed to this view. The viewer dispatches per-overlay JS modules off this list."
    },
    "layout": {
      "type": "object",
      "description": "Pre-baked layout payload. Optional: producers may omit it (consumers fall back to building their own layout from nodes + edges). When present, gives the consumer the exact graph the desktop --format dot renderer would emit — clusters, port-rank anchors, edge labels, and clock-domain palette included.",
      "required": ["engine", "dot"],
      "additionalProperties": true,
      "properties": {
        "engine": {
          "type": "string",
          "description": "Graphviz layout engine the dot string is intended for. Currently always 'dot'; reserved for future fdp/neato/sfdp variants."
        },
        "dot": {
          "type": "string",
          "description": "A full Graphviz DOT source string. Node IDs use the same instance-path scheme as nodes[].id so consumers can post-walk the SVG and round-trip identity via Graphviz's auto-emitted <title> elements."
        },
        "cluster_lookup": {
          "type": "object",
          "additionalProperties": {"type": "string"},
          "description": "Reverse map from Graphviz-sanitized cluster identifier (the <title> Graphviz emits on each <g class=\"cluster\">) to the original instance path. Producers using cluster-tree layout emit this so consumers can wire click handlers on cluster groups back to nodes[]. Producers that emit a flat box-and-arrow layout omit the field."
        }
      }
    }
  },
  "$defs": {
    "node": {
      "type": "object",
      "required": ["id", "module", "is_blackbox", "parameters", "ports", "overlays"],
      "additionalProperties": true,
      "properties": {
        "id": {
          "type": "string",
          "description": "Stable instance path, dot-separated from the top module. Reproducible across runs given the same RTL."
        },
        "module": {
          "type": "string",
          "description": "Module-type name this instance refers to."
        },
        "instance_name": {
          "type": ["string", "null"],
          "description": "Source-level instance name. null for the top node (the top isn't 'instantiated')."
        },
        "is_blackbox": {
          "type": "boolean",
          "description": "True when the module wasn't found in the filelist — viewers render with a dashed border."
        },
        "source": {
          "anyOf": [
            {"$ref": "#/$defs/source_block"},
            {"type": "null"}
          ],
          "description": "Source anchor for this node. May be null for synthetic / blackbox nodes the extractor never saw; real-world payloads populate this on every non-blackbox node."
        },
        "ports": {
          "type": "array",
          "items": {"$ref": "#/$defs/port"},
          "description": "Per-port binding for THIS instance. ``expr`` is the net expression the parent connected to the port at the instantiation site."
        },
        "parameters": {
          "type": "object",
          "additionalProperties": {"type": "string"},
          "description": "Parameter overrides applied to this instance. Empty object when none. Values are verbatim source slices ('32', '\"hello\"', '`MAX_WIDTH')."
        },
        "link": {
          "type": ["string", "null"],
          "description": "rtlbuddy:// URI pointing the hub at this node's source anchor. Null when no source location is known (blackboxes that the extractor never saw)."
        },
        "overlays": {
          "type": "object",
          "additionalProperties": {"type": "object"},
          "description": "Per-overlay metadata, keyed by overlay name. Missing keys mean no contribution; never an error."
        }
      }
    },
    "edge": {
      "type": "object",
      "required": ["from", "to", "port_pairs", "overlays"],
      "additionalProperties": true,
      "properties": {
        "from": {"type": "string"},
        "to": {"type": "string"},
        "port_pairs": {
          "type": "array",
          "items": {
            "type": "array",
            "items": {"type": ["string", "null"]},
            "minItems": 2,
            "maxItems": 2
          },
          "description": "Tuples of [net_expr_at_parent, child_port_name]. Used by the wave→view joiner (Phase 9) to trace signals across hierarchy levels."
        },
        "overlays": {
          "type": "object",
          "additionalProperties": {"type": "object"},
          "description": "Per-overlay edge metadata. ``clock.crossing: true`` marks a CDC edge (``clock.hazard: false`` when every crossing on it is recognised-safe, rtl-buddy-sch#211); ``reset.crossing: true`` an RDC edge."
        }
      }
    },
    "source_block": {
      "type": "object",
      "required": ["file"],
      "additionalProperties": true,
      "properties": {
        "file": {"type": "string"},
        "start_line": {"type": ["integer", "null"]},
        "start_column": {"type": ["integer", "null"]},
        "end_line": {"type": ["integer", "null"]},
        "end_column": {"type": ["integer", "null"]},
        "decl_line": {"type": ["integer", "null"]},
        "decl_col": {"type": ["integer", "null"]}
      }
    },
    "port": {
      "type": "object",
      "required": ["name"],
      "additionalProperties": true,
      "properties": {
        "name": {"type": "string"},
        "dir": {
          "type": ["string", "null"],
          "enum": ["input", "output", "inout", null]
        },
        "expr": {
          "type": ["string", "null"],
          "description": "Net expression bound to this port at instantiation. Null when no binding (the port is declared on the module but unconnected at this instance)."
        },
        "anchor": {
          "type": ["object", "null"],
          "additionalProperties": true,
          "properties": {
            "line": {"type": ["integer", "null"]},
            "col": {"type": ["integer", "null"]}
          }
        },
        "port_kind": {
          "type": "string",
          "enum": ["wire", "interface", "interface_signal"],
          "description": "Discriminator for the port's source-level shape. 'wire' (the default, omitted on the wire) is a scalar / vector signal with a direction. 'interface' marks an unresolved SystemVerilog interface port (``test_mem_if.sub m`` style) — a bundle of signals with no scalar direction; consumers should render it distinctively and the wave overlay should skip it. 'interface_signal' is the per-signal flattening of an interface port (e.g. ``m.req``, ``m.addr``) emitted when the interface body is in scope; it has a real ``dir`` pinned by the source modport and is value-badge-eligible. Wire ports MAY omit this field entirely to keep the payload minimal."
        },
        "interface_type": {
          "type": ["string", "null"],
          "description": "Interface name for interface ports (e.g. ``test_mem_if``). Present only when ``port_kind == \"interface\"``."
        },
        "modport": {
          "type": ["string", "null"],
          "description": "Modport name for interface ports (e.g. ``sub``). May be null when the source declared a bare interface port without a modport. Present only when ``port_kind == \"interface\"``."
        }
      }
    }
  }
}
