{
  "schema_version": "1.0",
  "top": "top",
  "tool": {
    "name": "rtl-buddy-view",
    "version": "0.1.0"
  },
  "nodes": [
    {
      "id": "top",
      "module": "top",
      "instance_name": null,
      "is_blackbox": false,
      "parameters": {},
      "ports": [
        {
          "name": "clk_a",
          "dir": "input",
          "expr": null,
          "anchor": null
        },
        {
          "name": "clk_b",
          "dir": "input",
          "expr": null,
          "anchor": null
        },
        {
          "name": "rst_n",
          "dir": "input",
          "expr": null,
          "anchor": null
        }
      ],
      "source": {
        "file": "/private/tmp/rtl-buddy-view-review/tests/fixtures/two_clock_two_reset_design/top.sv",
        "start_line": 12,
        "start_column": 1,
        "end_line": 20,
        "end_column": 10,
        "decl_line": 12,
        "decl_col": 1
      },
      "link": "rtlbuddy://open?file=/private/tmp/rtl-buddy-view-review/tests/fixtures/two_clock_two_reset_design/top.sv&line=12&col=1",
      "overlays": {
        "clock": {
          "clock": "clk_b"
        }
      }
    },
    {
      "id": "top.u_fifo",
      "module": "fifo",
      "instance_name": "u_fifo",
      "is_blackbox": false,
      "parameters": {},
      "ports": [
        {
          "name": "clk_a",
          "dir": "input",
          "expr": "clk_a",
          "anchor": {
            "line": 19,
            "col": 25
          }
        },
        {
          "name": "clk_b",
          "dir": "input",
          "expr": "clk_b",
          "anchor": {
            "line": 19,
            "col": 40
          }
        },
        {
          "name": "rst_n",
          "dir": "input",
          "expr": "rst_n",
          "anchor": {
            "line": 19,
            "col": 55
          }
        }
      ],
      "source": {
        "file": "/private/tmp/rtl-buddy-view-review/tests/fixtures/two_clock_two_reset_design/top.sv",
        "start_line": 19,
        "start_column": 10,
        "end_line": 19,
        "end_column": 62,
        "decl_line": 6,
        "decl_col": 1
      },
      "link": "rtlbuddy://open?file=/private/tmp/rtl-buddy-view-review/tests/fixtures/two_clock_two_reset_design/top.sv&line=19&col=10",
      "overlays": {
        "clock": {
          "clock": "clk_a"
        }
      }
    },
    {
      "id": "top.u_fifo.u_rd_ptr",
      "module": "ff",
      "instance_name": "u_rd_ptr",
      "is_blackbox": false,
      "parameters": {},
      "ports": [
        {
          "name": "clk",
          "dir": "input",
          "expr": "clk_b",
          "anchor": {
            "line": 12,
            "col": 23
          }
        },
        {
          "name": "rst_n",
          "dir": "input",
          "expr": "rst_n",
          "anchor": {
            "line": 12,
            "col": 38
          }
        },
        {
          "name": "q",
          "dir": "output",
          "expr": "",
          "anchor": {
            "line": 12,
            "col": 46
          }
        }
      ],
      "source": {
        "file": "/private/tmp/rtl-buddy-view-review/tests/fixtures/two_clock_two_reset_design/fifo.sv",
        "start_line": 12,
        "start_column": 8,
        "end_line": 12,
        "end_column": 51,
        "decl_line": 4,
        "decl_col": 1
      },
      "link": "rtlbuddy://open?file=/private/tmp/rtl-buddy-view-review/tests/fixtures/two_clock_two_reset_design/fifo.sv&line=12&col=8",
      "overlays": {
        "clock": {
          "clock": "clk_b"
        },
        "reset": {
          "reset": "rst_n",
          "polarity": "low",
          "type": "async"
        }
      }
    },
    {
      "id": "top.u_fifo.u_wr_ptr",
      "module": "ff",
      "instance_name": "u_wr_ptr",
      "is_blackbox": false,
      "parameters": {},
      "ports": [
        {
          "name": "clk",
          "dir": "input",
          "expr": "clk_a",
          "anchor": {
            "line": 11,
            "col": 23
          }
        },
        {
          "name": "rst_n",
          "dir": "input",
          "expr": "rst_n",
          "anchor": {
            "line": 11,
            "col": 38
          }
        },
        {
          "name": "q",
          "dir": "output",
          "expr": "",
          "anchor": {
            "line": 11,
            "col": 46
          }
        }
      ],
      "source": {
        "file": "/private/tmp/rtl-buddy-view-review/tests/fixtures/two_clock_two_reset_design/fifo.sv",
        "start_line": 11,
        "start_column": 8,
        "end_line": 11,
        "end_column": 51,
        "decl_line": 4,
        "decl_col": 1
      },
      "link": "rtlbuddy://open?file=/private/tmp/rtl-buddy-view-review/tests/fixtures/two_clock_two_reset_design/fifo.sv&line=11&col=8",
      "overlays": {
        "clock": {
          "clock": "clk_a"
        },
        "reset": {
          "reset": "rst_n",
          "polarity": "low",
          "type": "async"
        }
      }
    },
    {
      "id": "top.u_rstgen",
      "module": "rstsync",
      "instance_name": "u_rstgen",
      "is_blackbox": false,
      "parameters": {},
      "ports": [
        {
          "name": "clk",
          "dir": "input",
          "expr": "clk_b",
          "anchor": {
            "line": 18,
            "col": 28
          }
        },
        {
          "name": "rst_n",
          "dir": "input",
          "expr": "rst_n",
          "anchor": {
            "line": 18,
            "col": 43
          }
        },
        {
          "name": "rst_sync",
          "dir": "output",
          "expr": "rst_sync",
          "anchor": {
            "line": 18,
            "col": 61
          }
        }
      ],
      "source": {
        "file": "/private/tmp/rtl-buddy-view-review/tests/fixtures/two_clock_two_reset_design/top.sv",
        "start_line": 18,
        "start_column": 13,
        "end_line": 18,
        "end_column": 71,
        "decl_line": 7,
        "decl_col": 1
      },
      "link": "rtlbuddy://open?file=/private/tmp/rtl-buddy-view-review/tests/fixtures/two_clock_two_reset_design/top.sv&line=18&col=13",
      "overlays": {
        "clock": {
          "clock": "clk_b"
        }
      }
    },
    {
      "id": "top.u_rstgen.u_sync",
      "module": "ff",
      "instance_name": "u_sync",
      "is_blackbox": false,
      "parameters": {},
      "ports": [
        {
          "name": "clk",
          "dir": "input",
          "expr": "clk",
          "anchor": {
            "line": 12,
            "col": 21
          }
        },
        {
          "name": "rst_n",
          "dir": "input",
          "expr": "rst_n",
          "anchor": {
            "line": 12,
            "col": 34
          }
        },
        {
          "name": "q",
          "dir": "output",
          "expr": "rst_sync",
          "anchor": {
            "line": 12,
            "col": 45
          }
        }
      ],
      "source": {
        "file": "/private/tmp/rtl-buddy-view-review/tests/fixtures/two_clock_two_reset_design/rstgen.sv",
        "start_line": 12,
        "start_column": 8,
        "end_line": 12,
        "end_column": 55,
        "decl_line": 4,
        "decl_col": 1
      },
      "link": "rtlbuddy://open?file=/private/tmp/rtl-buddy-view-review/tests/fixtures/two_clock_two_reset_design/rstgen.sv&line=12&col=8",
      "overlays": {
        "clock": {
          "clock": "clk_b"
        },
        "reset": {
          "is_synchronizer": true
        }
      }
    }
  ],
  "edges": [
    {
      "from": "top",
      "to": "top.u_fifo",
      "port_pairs": [
        [
          "clk_a",
          "clk_a"
        ],
        [
          "clk_b",
          "clk_b"
        ],
        [
          "rst_n",
          "rst_n"
        ]
      ],
      "overlays": {}
    },
    {
      "from": "top",
      "to": "top.u_rstgen",
      "port_pairs": [
        [
          "clk_b",
          "clk"
        ],
        [
          "rst_n",
          "rst_n"
        ],
        [
          "rst_sync",
          "rst_sync"
        ]
      ],
      "overlays": {}
    },
    {
      "from": "top.u_fifo",
      "to": "top.u_fifo.u_rd_ptr",
      "port_pairs": [
        [
          "clk_b",
          "clk"
        ],
        [
          "rst_n",
          "rst_n"
        ],
        [
          "",
          "q"
        ]
      ],
      "overlays": {
        "reset": {
          "crossing": true
        }
      }
    },
    {
      "from": "top.u_fifo",
      "to": "top.u_fifo.u_wr_ptr",
      "port_pairs": [
        [
          "clk_a",
          "clk"
        ],
        [
          "rst_n",
          "rst_n"
        ],
        [
          "",
          "q"
        ]
      ],
      "overlays": {}
    },
    {
      "from": "top.u_rstgen",
      "to": "top.u_rstgen.u_sync",
      "port_pairs": [
        [
          "clk",
          "clk"
        ],
        [
          "rst_n",
          "rst_n"
        ],
        [
          "rst_sync",
          "q"
        ]
      ],
      "overlays": {}
    }
  ],
  "overlays_present": [
    "clock",
    "reset"
  ]
}
