{
  "schema_version": "1.0",
  "top": "top",
  "tool": {
    "name": "rtl-buddy-view",
    "version": "0.1.0"
  },
  "nodes": [
    {
      "id": "top",
      "module": "top",
      "instance_name": null,
      "is_blackbox": false,
      "parameters": {},
      "ports": [],
      "source": {
        "file": "/private/tmp/rtl-buddy-view-review/tests/fixtures/connection_shapes/top.sv",
        "start_line": 8,
        "start_column": 1,
        "end_line": 12,
        "end_column": 10,
        "decl_line": 8,
        "decl_col": 1
      },
      "link": "rtlbuddy://open?file=/private/tmp/rtl-buddy-view-review/tests/fixtures/connection_shapes/top.sv&line=8&col=1",
      "overlays": {}
    },
    {
      "id": "top.u_named",
      "module": "sub",
      "instance_name": "u_named",
      "is_blackbox": true,
      "parameters": {
        "WIDTH": "16",
        "DEPTH": "32"
      },
      "ports": [
        {
          "name": "clk",
          "dir": null,
          "expr": "clk",
          "anchor": {
            "line": 9,
            "col": 51
          }
        },
        {
          "name": "rst_n",
          "dir": null,
          "expr": "rst_n",
          "anchor": {
            "line": 9,
            "col": 64
          }
        },
        {
          "name": "q",
          "dir": null,
          "expr": "q",
          "anchor": {
            "line": 9,
            "col": 75
          }
        }
      ],
      "source": {
        "file": "/private/tmp/rtl-buddy-view-review/tests/fixtures/connection_shapes/top.sv",
        "start_line": 9,
        "start_column": 37,
        "end_line": 9,
        "end_column": 78,
        "decl_line": null,
        "decl_col": null
      },
      "link": "rtlbuddy://open?file=/private/tmp/rtl-buddy-view-review/tests/fixtures/connection_shapes/top.sv&line=9&col=37",
      "overlays": {}
    },
    {
      "id": "top.u_pos",
      "module": "sub",
      "instance_name": "u_pos",
      "is_blackbox": true,
      "parameters": {},
      "ports": [],
      "source": {
        "file": "/private/tmp/rtl-buddy-view-review/tests/fixtures/connection_shapes/top.sv",
        "start_line": 10,
        "start_column": 37,
        "end_line": 10,
        "end_column": 60,
        "decl_line": null,
        "decl_col": null
      },
      "link": "rtlbuddy://open?file=/private/tmp/rtl-buddy-view-review/tests/fixtures/connection_shapes/top.sv&line=10&col=37",
      "overlays": {}
    },
    {
      "id": "top.u_short",
      "module": "sub",
      "instance_name": "u_short",
      "is_blackbox": true,
      "parameters": {},
      "ports": [
        {
          "name": "clk",
          "dir": null,
          "expr": "",
          "anchor": {
            "line": 11,
            "col": 46
          }
        },
        {
          "name": "rst_n",
          "dir": null,
          "expr": "",
          "anchor": {
            "line": 11,
            "col": 52
          }
        },
        {
          "name": "q",
          "dir": null,
          "expr": "",
          "anchor": {
            "line": 11,
            "col": 60
          }
        }
      ],
      "source": {
        "file": "/private/tmp/rtl-buddy-view-review/tests/fixtures/connection_shapes/top.sv",
        "start_line": 11,
        "start_column": 37,
        "end_line": 11,
        "end_column": 63,
        "decl_line": null,
        "decl_col": null
      },
      "link": "rtlbuddy://open?file=/private/tmp/rtl-buddy-view-review/tests/fixtures/connection_shapes/top.sv&line=11&col=37",
      "overlays": {}
    }
  ],
  "edges": [
    {
      "from": "top",
      "to": "top.u_named",
      "port_pairs": [
        [
          "clk",
          "clk"
        ],
        [
          "rst_n",
          "rst_n"
        ],
        [
          "q",
          "q"
        ]
      ],
      "overlays": {}
    },
    {
      "from": "top",
      "to": "top.u_pos",
      "port_pairs": [
        [
          "clk",
          null
        ],
        [
          "rst_n",
          null
        ],
        [
          "q",
          null
        ]
      ],
      "overlays": {}
    },
    {
      "from": "top",
      "to": "top.u_short",
      "port_pairs": [
        [
          "",
          "clk"
        ],
        [
          "",
          "rst_n"
        ],
        [
          "",
          "q"
        ]
      ],
      "overlays": {}
    }
  ],
  "overlays_present": []
}
