{
  "schema_version": "1.0",
  "top": "top",
  "tool": {
    "name": "rtl-buddy-view",
    "version": "0.1.0"
  },
  "nodes": [
    {
      "id": "top",
      "module": "top",
      "instance_name": null,
      "is_blackbox": false,
      "parameters": {},
      "ports": [
        {
          "name": "clk_a",
          "dir": "input",
          "expr": null,
          "anchor": null
        },
        {
          "name": "clk_b",
          "dir": "input",
          "expr": null,
          "anchor": null
        }
      ],
      "source": {
        "file": "/private/tmp/rtl-buddy-view-review/tests/fixtures/two_clock_design/top.sv",
        "start_line": 9,
        "start_column": 1,
        "end_line": 14,
        "end_column": 10,
        "decl_line": 9,
        "decl_col": 1
      },
      "link": "rtlbuddy://open?file=/private/tmp/rtl-buddy-view-review/tests/fixtures/two_clock_design/top.sv&line=9&col=1",
      "overlays": {
        "clock": {
          "clock": "clk_a"
        }
      }
    },
    {
      "id": "top.u_fifo",
      "module": "fifo",
      "instance_name": "u_fifo",
      "is_blackbox": false,
      "parameters": {},
      "ports": [
        {
          "name": "clk_a",
          "dir": "input",
          "expr": "clk_a",
          "anchor": {
            "line": 13,
            "col": 25
          }
        },
        {
          "name": "clk_b",
          "dir": "input",
          "expr": "clk_b",
          "anchor": {
            "line": 13,
            "col": 40
          }
        }
      ],
      "source": {
        "file": "/private/tmp/rtl-buddy-view-review/tests/fixtures/two_clock_design/top.sv",
        "start_line": 13,
        "start_column": 10,
        "end_line": 13,
        "end_column": 47,
        "decl_line": 5,
        "decl_col": 1
      },
      "link": "rtlbuddy://open?file=/private/tmp/rtl-buddy-view-review/tests/fixtures/two_clock_design/top.sv&line=13&col=10",
      "overlays": {
        "clock": {
          "clock": "clk_a"
        }
      }
    },
    {
      "id": "top.u_fifo.u_rd_ptr",
      "module": "ff",
      "instance_name": "u_rd_ptr",
      "is_blackbox": false,
      "parameters": {},
      "ports": [
        {
          "name": "clk",
          "dir": "input",
          "expr": "clk_b",
          "anchor": {
            "line": 10,
            "col": 23
          }
        },
        {
          "name": "q",
          "dir": "output",
          "expr": "",
          "anchor": {
            "line": 10,
            "col": 31
          }
        }
      ],
      "source": {
        "file": "/private/tmp/rtl-buddy-view-review/tests/fixtures/two_clock_design/fifo.sv",
        "start_line": 10,
        "start_column": 8,
        "end_line": 10,
        "end_column": 36,
        "decl_line": 4,
        "decl_col": 1
      },
      "link": "rtlbuddy://open?file=/private/tmp/rtl-buddy-view-review/tests/fixtures/two_clock_design/fifo.sv&line=10&col=8",
      "overlays": {
        "clock": {
          "clock": "clk_b"
        }
      }
    },
    {
      "id": "top.u_fifo.u_wr_ptr",
      "module": "ff",
      "instance_name": "u_wr_ptr",
      "is_blackbox": false,
      "parameters": {},
      "ports": [
        {
          "name": "clk",
          "dir": "input",
          "expr": "clk_a",
          "anchor": {
            "line": 9,
            "col": 23
          }
        },
        {
          "name": "q",
          "dir": "output",
          "expr": "",
          "anchor": {
            "line": 9,
            "col": 31
          }
        }
      ],
      "source": {
        "file": "/private/tmp/rtl-buddy-view-review/tests/fixtures/two_clock_design/fifo.sv",
        "start_line": 9,
        "start_column": 8,
        "end_line": 9,
        "end_column": 36,
        "decl_line": 4,
        "decl_col": 1
      },
      "link": "rtlbuddy://open?file=/private/tmp/rtl-buddy-view-review/tests/fixtures/two_clock_design/fifo.sv&line=9&col=8",
      "overlays": {
        "clock": {
          "clock": "clk_a"
        }
      }
    }
  ],
  "edges": [
    {
      "from": "top",
      "to": "top.u_fifo",
      "port_pairs": [
        [
          "clk_a",
          "clk_a"
        ],
        [
          "clk_b",
          "clk_b"
        ]
      ],
      "overlays": {}
    },
    {
      "from": "top.u_fifo",
      "to": "top.u_fifo.u_rd_ptr",
      "port_pairs": [
        [
          "clk_b",
          "clk"
        ],
        [
          "",
          "q"
        ]
      ],
      "overlays": {
        "clock": {
          "crossing": true
        }
      }
    },
    {
      "from": "top.u_fifo",
      "to": "top.u_fifo.u_wr_ptr",
      "port_pairs": [
        [
          "clk_a",
          "clk"
        ],
        [
          "",
          "q"
        ]
      ],
      "overlays": {}
    }
  ],
  "overlays_present": [
    "clock"
  ]
}
